prompot,completion（内涵）
唯识观,"唯识观，佛教术语，梵文vijñānamātra paśyati，或vijñaptimātra paśyati，是佛陀三时教法的观修法门。就是观唯识无境，只有内在的心识（阿赖耶识），没有心识之外的事物。就是观凡夫以为的心外事物是根本不存在的，存在的只是心外事物不存在而凡夫误以为心外事物存在的这个错觉、这个虚妄分别。就是观凡夫世界只是虚妄分别，除此之外什么都没有。始终坚持唯识无境，圣者能见的凡夫心外一无所有，这才是真实的了义佛法。
"
唯心所现,唯心所现，佛教术语，梵文svacittadṛśyamātra，意思是“只有心自己的显现”。这是佛陀三时教法教理体系的一个词语，与“境界自心现”是同义词，是三时教法的核心词汇之一。
了义,了义，佛教术语，梵文是nītārtha，指最上的、最契合真实的、最圆满的道理，是相对“不了义”而言。“了”有两方面的含义，第一，是很清楚、很明白的意思；第二，是全面了解、毫无保留的意思，“义”就是道理，这里特指佛陀所说佛法的法义，了义有时也称为“胜义”、“最胜义”。
四弘誓愿,四弘誓愿，佛教术语，也叫做“通愿”、“共愿”，指四个宏大的誓愿，是修行大乘佛法、誓愿成就无上菩提的众生都要发的愿。四弘誓愿的内容是：众生无边誓愿度，烦恼无尽誓愿断，法门无量誓愿学，佛道无上誓愿成。
如理思维,如理思维，佛教术语，来源于“正闻熏习、如理思维”这句话。首先要听闻正法，听闻了正法就要如理思维，就是按照佛陀的教法认真思考，反反复复的思考，思考的目的是对佛陀教法要生起确定的信心。
如梦观,如梦观，佛教术语，梵文svapnôpamatā draṣṭavya，佛教经常用梦比喻凡夫自以为的真实的世界其实如梦境一般，梦中感觉很真实的事物，梦醒之后会发现，其实根本就没有存在过，目的是破除凡夫对凡夫自以为的真实世界的理解。
轮回,轮回，印度宗教哲学术语，梵文samsāra，是印度古人的一种生命观，主要指“三世的六道轮回”的生命观，也被称为“六道轮回”。
无明,"无明，印度哲学术语，梵文avidyā，指不明真理，不见真实，即对真理、对真实的无知，就是无
明。在佛教中，无明是障碍着众生获得解脱的根本原因。佛陀认为，凡夫之所以轮回于生死、不能涅槃、不能成佛，原因是糊涂，把不真实的当成真实，见不到真正的真实，犯了增益与损减的错误。这个糊涂，佛教有个专有名词来表达，梵文是“avidyā”，翻译成汉语就是“无明”。"
随顺真实,随顺真实，佛教术语，指佛陀所说法随顺佛陀亲证的真正的真实性——真如。
随顺众生,随顺众生，佛教术语，指佛陀所说法随顺众生的根性，也就是要适度地向凡夫做些妥协，但妥协的目的是要接引众生，走向佛陀证悟的真实。
闻不厌足,闻不厌足，佛教术语，指听闻佛陀的正法，永远都不要疲厌和满足。
人我,人我，佛教术语，作为一个凡夫，会认为自己内在的主观的精神世界，是一个真实存在，而且是不变的，独立的。凡夫死死地执着的这个内在主观精神的世界的真实的存在，佛教称为“人我”。人我，就是印度思想家们所坚持认为的、在生死轮回的背后，那个常一不变、独立存在的轮回的精神主体。
法我,法我，佛教术语，梵文dharmasvabhāva，指法的自性，即客观物质世界的真实存在性。即凡夫执著的外在客观物质世界的独立存在、常一不变性，佛教就称为“法我”。
轮回无我（人我空）,轮回无我，净名术语，指生命从生到死、死亡到再生的流转背后没有一个常一不变、独立存在的精神主体，也就是说，并没有“我”这一精神主体在轮回，这是对小乘涅槃境界的总结。 
涅槃寂静,涅槃寂静，佛教术语，指通过修行，能够解决了内在的自我的烦恼而获得的一种自我的清静的状态，涅槃寂静是佛教初时教法讲的涅槃境界。
菩萨,"菩萨，佛教术语，梵文bodhisattva，由两个词组成，bodhi是觉，sattva指有情、众生，音译是“菩提萨埵”，简称“菩萨”，意译“觉有情”，就是“自觉觉他的有情”。一个众生、一个有情，发了菩提心，就可以说是菩萨，发菩提心的众生就是菩萨，也只有发了菩提心的菩萨，修菩萨行，才能成佛。
"
菩萨道,菩萨道，佛教术语，梵文bodhisattva-caryā，亦称菩萨行，就是度众生而且度了众生还得当没度，也就是菩萨是以度众生的觉他方式而实现自觉的，是以度众生的方式来修行的，这是大乘佛法区别于小乘佛法、区别于人天乘佛法的最大要害。
菩提心,菩提心，佛教术语，梵文bodhicitta，bodhi音译为“菩提”，意译为“觉”，从糊涂到明白的过程就叫bodhi，就叫觉。citta译为“心”，表示精神活动。菩提心直译就是觉的心，大乘佛法的解脱方案是打破无明见真实，就是一个从糊涂走向明白的历程，就是希求众生从糊涂的凡夫走向智者境界而解脱的觉悟的心，就是一个修行大乘佛法的人，他们并不仅仅希求自我的解脱，而是希求众生的解脱，而且把一切众生的解脱当作自己的解脱，把度化一切众生走向解脱当作自己修行解脱的路径——这样的思想境界，这样心境的生起，佛教给了一个专有名词，叫作“菩提心”，大乘佛法的修行归根结底就是“bodhi”这个觉的心、菩提心的生起与修为的过程。
缘生性空,缘生性空，佛教术语，缘生，梵文pratītyasamutpanna，性空，梵文niḥsvabhāva，缘生就是事物所谓的存在，不过是种种条件的聚合而产生的临时的、松散性的存在，因此，缘生的事物肯定不存在着一个独立于条件、独立于缘的独立存在性，这个独立存在性肯定是不存在的，就叫性空。缘生性空，是在解构我们凡夫对凡夫境界上常一不变的独立存在的事物的执著，对常一不变的独立存在性的执著，又叫“我执”，讲缘生性空，破的就是我执，佛陀说无我。
性空,性空，佛教术语，梵文niḥsvabhāva，另外亦有asvabhāva、svabhāva-śūnya等形式，直译是无自性、自性空，“无自性”就是不存在，性空的“性”对应的梵文是svabhāva，bhāva是存在，sva指与其他没有关系的、独立的、自我的，svabhāva即独立的存在性、自我的存在性，也译作“自性”，简译为“性”，niḥ、a都是否定前缀，表示没有，śūnya意思是没有，空，零，什么都没有，性空即无自性——没有自我的独立存在性，这是凡夫境界上存在的一个重要特点，佛陀讲性空，只是解构我们凡夫对凡夫境界的那种执着，执着凡夫境界的常一不变性、独立存在性。
缘生,缘生的“缘”就是“条件”，所谓缘生，就是事物所谓的存在，不过是种种条件的聚合而产生的临时的、松散性的存在。缘生的事物，是没有独立存在性的，没有常一不变性的，也就是无自性的。佛陀安立缘生的概念，是一种解构，是佛陀解构我们凡夫对凡夫境界的真实存在的一个解构的方便善巧。
空性,空性，佛教术语，梵文śūnyatā，śūnya意思是没有，空，零，什么都没有，不存在，词尾tā，表示基本特征，基于佛陀二时教法定义空性，就是凡夫境界上的存在，是以什么都不存在为基本特征，这件事叫“空性”，在佛陀三时教法里，遍计所执自性根本、从来就不存在，给这件事儿起名叫“空性”，在二时和三时教法中，佛陀说空，不是把原来存在变为不存在，佛陀说空是说原本就根本从来没有存在过，这个特征叫“空性”，不管是二时教法还是三时教法，佛陀安立空性，是为了解构凡夫境界，是为了破除凡夫的实执、法执，就是为了破增益，而不是补损减，大乘佛法思想的不共，首先体现在无生、空性，能不能理解接受无生、空性，是进入大乘佛法的门槛，也是佛教与非佛教思想的差异。
声闻乘,"声闻乘，佛教术语，梵文śrāvakayāna，声闻这个词的本意是倾听者，更广义的就是指信徒，一切听闻佛法、听佛说法的人都可以称为声闻，乘是佛陀度化众生走向解脱的法，声闻乘属于小乘佛法，主要指的是初时教法中的四圣谛法门——知苦、断集、证灭、修道。
声闻乘行者是通过听闻佛陀说的初时教法、闻法信受、精进修行、最终证悟个体解脱的这类众生。声闻乘的修行，通过受三皈依戒成就信根，坚信四圣谛，修五停心观等，进第五地的戒定慧三学的成就。再进入声闻乘的见道位，这就是声闻乘的第六地。声闻乘的第七地到第十地，分别对应的就是须陀洹、斯陀含、阿那含和阿罗汉果位。"
三十七道品,"""三十七道品""，佛教术语，梵文saptatriṃśadbodhipakṣyān dharmān，又名三十七菩提分法。
“三十七道品”是修行的三十七个具体的内容，实际是“声闻乘”，也就是佛陀的“初时教法”或者叫作“小乘佛法”里最主要的修行方法。三十七项内容可分为七组，依照《清净道论》，名为“四念处”、“四正勤”、“四神足”、“五根”、“五力”、“七觉支”、“八支圣道”。“三十七道品”，是典型的“声闻乘”修行者的修行，《维摩诘经》中说“三十七道品”是菩萨净土，也就是修行大乘佛法的人，以发无上的菩提心之后，由菩提心摄受下去修“三十七道品”，所以“三十七道品”也是大乘佛法的修行。"
出离心,出离心，佛教术语，指基于三世六道轮回的生命观生起的出离生死轮回、寻求解脱、希求涅槃的心。
除妄即真,除妄即真，净名精舍术语，佛陀在初时教法中把凡夫世界不真实的东西除掉了，然后说那就是真，但对于外部世界是否存在的问题是没有明确说明的，也就是说佛陀在这里采用的是以“不是什么”的表达模式来表达诸法的真实，来表达他所证悟的真实性的。
涅槃,涅槃，佛教术语，梵文nirvāṇa，nirvāṇa是niḥ+√vā的过去分词，词根vā，指吹、熄灭，niḥ，指没有，也有出、离、去、往外的意思，nirvāṇa原指吹灭，或吹灭之状态，这个词的基本含义就是熄灭涅槃，意译为灭、灭度、寂灭、圆寂、解脱、无为、自在等，“nirvāṇa”这个梵文词在印度民间的俗语形态是nibbāna，汉传佛教从nibbāna这个词音译成汉语就是涅槃，在三世说生命观的背景下涅槃特指生死轮回的熄灭。佛法是释迦牟尼给出的，能够最有效的引领众生走向涅槃的解决方案。释迦牟尼给出的涅槃方案与印度其他宗教家给出的涅槃方案有根本上的不共之处。
初时教法,初时教法，佛教术语，指佛陀立足凡夫境界向凡夫说的一类法，以“四谛、无我、涅槃寂静”三个基本道理为核心内容。佛陀初时教法的代表性经典，在汉传佛教里边是《阿含经》。初时教法可以概括为八个字：“四谛无我、涅槃寂静”。初时教法讲四谛，讲十二缘起，讲人我空。人我空就是解构凡夫对人我的执着。初时教法以“除妄即真”极为隐秘地遮诠诸法真实性。《解深密经》中说，初时教法是佛陀“惟为发趣声闻乘者，以四谛相转正法轮”。就是初时教法是讲给发小乘心的众生听的，讲的内容是苦、集、灭、道四谛法。通过初时教法的修行，证悟人无我，能够解决内在的自我烦恼而获得一种自我的清净的状态，叫作“涅槃寂静”。
人天乘,人天乘，佛教术语，指佛陀给认同三世说生命观但生不起出离心、不想趣向于涅槃的一类众生说的法。八个字的概括：“五戒十善，人天果报”。
三世说,三世说，净名精舍术语，“三世”梵文taiyadhvika，是印度古人普遍对生命的一种理解和观点，认为生命是在“过去、现在、未来”这三世中轮转，故称“三世说”生命观。印度古人对生命的理解是，人的死亡不是生命的彻底的终结，死亡只是肉体的抛弃，那个精神的因素——“神识”没有死，这个神识要通过投胎转化成另一个生命体又回到这世界上来。回来以后，寿命还是有限的，死了以后神识再转化成下一个生命体再回到这世界上来，如此生生死死在“过去、现在、未来”这三世中轮回不已。
无常无我,（拆分了无常和无我两个词，本词条原文没有很好的定义）
四谛,四谛，佛教术语，梵文 catur-vidhaṃ satyam，“苦、集、灭、道”，在佛教里叫做“四谛”，“谛”就是道理。初时教法讲四谛，讲无我，只讨论人我，没讨论法我。
八正道,八正道，佛教术语，梵文 āryāṣṭāṅga-mārga，又称八圣道、八支正道等。是初时教法四谛中道谛的具体内容。包括：正见、正思维、正语、正业、正命、正方便、正念、正定。指小乘修行人证人我空，断除自己内心的烦恼和痛苦，证得清净的涅槃解脱境界的正确方法或途径。
十二缘起,十二缘起，佛教术语，梵文dvādaśāvga pratītya-samutpāda，亦称“十二因缘”、“十二支”，是佛教解构误以为轮回当中有人我的一个理论，认为生命过程可以分为彼此成为条件或因果联系的环节，是佛陀建立的三大缘起之一，是初时教法破增益的缘起，是缘起的方便说，是部分听闻和缘觉乘修行的法，具体内容就是无明缘行、行缘识、识缘名色、名色缘六处、六处缘触、触缘受、受缘爱、爱缘取、取缘有、有缘生，生缘老死。
涅槃还灭门,涅槃还灭门，佛教术语，与生死流转门相对，是小乘初时教法十二缘起的内容，即以无明尽打头，以“此无故彼无，此灭故彼灭”的形式描述智者走向解脱的状态，具体讲就是无明尽导致行尽，行尽导致识尽，识尽导致名色尽，名色尽导致六处尽，六处尽导致触尽，触尽导致受尽，受尽导致爱尽，爱尽导致取尽，取尽导致有尽，有尽导致生尽，生尽导致老死尽。
生死流转门,生死流转门，佛教术语，与涅槃还灭门相对，是小乘初时教法十二缘起的内容，即以无明打头，以“此有故彼有，此生故彼生”的形式，描述凡夫自以为的生生死死流转不已的生命轮回状态，具体讲就是无明缘行，行缘识，识缘名色，名色缘六处，六处缘触，触缘受，受缘爱，爱缘取，取缘有，有缘生，生缘老死。
十二处,"十二处，印度哲学术语，梵文āyatana，又称“十二入”、简称“处”，指凡夫对自以为的真实世界的一种划分方式。
十二处，就是把凡夫境界的一切的存在，分成了十二个状态。这十二处分为两组：第一组，“六根”，也叫“内六处”，即“眼、耳、鼻、舌、身、意”，描述凡夫内在的主观心识活动；第二组，“六尘”，也叫“外六处”，即“色、声、香、味、触、法”，描述凡夫内在主观心识所对应的那个外境。这两组六个合起来就叫“十二处”，即“眼处、耳处、鼻处、舌处、身处、意处”和“色处、声处、香处、味处、触处、法处”。所以这十二处，就是对凡夫境界凡夫自以为的一切存在的描述。"
十八界,十八界，印度哲学术语，梵文aṣṭādaśa dhātavaḥ，把凡夫境界上的一切的存在分成十八项，佛教叫“十八界”。十八界分成了三组，第一组，叫“六尘”，是凡夫所对的外在物质的存在的世界，分为色、声、香、味、触、法。第二组，众生还有内在的心识，这叫“六识”： 眼识、耳识、鼻识、舌识、身识和意识。这“六识”要根植于众生的六个器官才能产生作用，这个六个器官佛教称为“六根”，六根是第三组，就是眼根、耳根、鼻根、舌根、身根和意根。所以这三组六个合起来，叫作“十八界”，即“眼界、耳界、鼻界、舌界、身界、意界”，“色界、声界、香界、味界、触界、法界”和“眼识界、耳识界、鼻识界、舌识界、身识界、意识界”。这是佛教对于我们凡夫境界上的一切的存在的一种划分方式。
权便中观,权便中观，净名精舍术语，是净名精舍首席学术导师于晓非老师依据佛陀二时教法经典构建的“四重二谛”，即基于既不常也不断、既非有也非无的二谛对治模式而建立的一种中观，是接引众生证空性的过程中的阶段性的方便善巧。
遮诠,遮诠，印度哲学术语，与表诠相对，遮诠就是间接陈述，就是不以肯定形式，而是以否定的形式做解释。二时教法用遮诠的方式——“不是什么”这样一种隐秘的方法，佛教叫“隐秘相”，而说诸法的真实性。
实相离言,实相离言，佛教术语，实相，又名法性、真如、如如、如来藏等，指圣者证悟的真实和真实性，离言，不能够用凡夫语言表达，实相离言就是指圣者境界圣者证悟的真实和真实性是有的，但这个真实性是不能够用语言诠表。
二时四有四无无障碍观,二时四有四无无障碍观，净名精舍术语，指净名精舍大乘佛法二时教法的观修口诀，是净名精舍首席学术导师于晓非老师效仿古德构建佛陀二时教法教理体系的权变中观的“四重二谛”纲领后，依据韩镜清先生“四有四无无障碍观”而总结的修法口诀。 具体内容是四句话：只有相互依存，没有独立存在；只有相似相续，没有常一不变；只有能诠名言，没有所诠实义；只有“离言空性”，没有丝毫法生。
三法印,三法印，佛教术语，梵文Tridṛṣṭinimittamudrā（待确认），指印证某一理论是否为佛法正见的三个基本准则：诸行无常、诸法无我、涅槃寂静。法，理法；印，指印证鉴别。能印证真伪佛法之印，故名法印，也就是鉴别真伪佛法的义理标准，如果打着宣讲佛法的旗号，但宣说的法义连三法印都不符合，那么可以就断定它不是佛法。
“离言空性”,“离言空性”，净名精舍术语，是大乘佛法二时教法中“四重二谛”第四重二谛的“胜义谛”，佛陀把凡夫境界一切的存在，包括名言，都解构干净了，没有一丝丝法的生起——凡夫境界一切法无生，连“离言空性”这四个字也要舍弃。既然“离言”，“离言空性”四个字都是多余的，但是为了度化凡夫，又不得不暂且还要安立这四个字，因此“离言空性”这四个字还要画上引号。
对治,对治，佛教术语，梵文pratipakṣa，原意是指能治，所治，除遣，弃舍，断除的意思，佛法就是佛陀用来对治凡夫无明的言教。因此，佛陀说法，全是对治，不管是“见佛闻法”的分别，还是“以楔出楔”的言说，都只是引领众生悟入佛陀亲证真实性的工具、方便和善巧，都只是过河的筏子，凡夫众生只要真正证入了宗通，这些工具和筏子都要舍弃。
二谛,二谛，佛教术语，谛，是道理的意思，二谛，就是两条道理：一个就叫做“世俗谛”，另一个被称为“胜义谛”。二谛是佛陀在二时教法中度化众生的一个非常有效的方便和手段。世俗谛是佛陀作为一位智者，为了度化众生，迫不得已地向众生做妥协而建立的道理。胜义谛就是在此世俗谛上，佛陀一定要引申出作为智者对这一重世俗谛境界的一个更殊胜的理解，这就是胜义谛。
假有唯名,假有唯名，净名精舍术语，是大乘佛法，二时教法中净名精舍四重二谛中的一条术语。指凡夫境界一切事物只有假说的名字而已，名字背后没有任何对应的真实事物存在。假有唯名，是四重二谛中第四重二谛的世俗谛。在第四重二谛的世俗谛中，为了凸显只剩下名言，把第三重二谛胜义谛“名言假有”的语序略作调整，称为“假有唯名”，也就是通过前三重二谛的解构，凡夫境界仅仅只剩下点“名言”了。
解构,解构，净名精舍术语，通俗地讲，解构就是拆开、打散。在解读佛法时，净名精舍首席学术导师于晓非老师借用这个现代词汇，形象地表明佛陀讲法的过程和目的，就是不断的拆解，打散无明凡夫坚固的实有见。也就是佛陀他老人家对世界的理解和无明凡夫对世界的理解，完全是颠倒的，正好相反了。凡夫死死执著着根本不存在的凡夫境界而自以为是真正实存在，为了破除凡夫的这种错误观点，佛陀对无明凡夫进行不断的解构，以引领无明凡夫证悟真实。“解构”是一个很现代的词语，其实解构的过程，用佛教的语言表达就是一个字，“空”，就是空的过程，不断地空的过程。
名言假有,名言假有，净名精舍术语，是大乘佛法，二时教法中净名精舍四重二谛中的一条术语。指凡夫境界上一切的事物都根本不存在，只是误以为存在，这个误以为的存在，叫假有；凡夫给这个误以为的存在还要起一个名，这个名，就是名言。名言假有，是第三重二谛的胜义谛。
破实执,破实执，佛教术语，这里的实执，特指大乘佛法二时教法中的“法我执”。也就是凡夫以为的独立于内在主观精神的人我之外的那个外在客观物质世界，就是法我。对这个外在客观物质世界的执著就是“法我执”。破实执，就是破除掉对法我的执著，属于佛陀横向教理体系中破增益的部分。
破我执,破我执，佛教术语，佛法中对常一不变的独立存在性的执着，叫我执，大乘佛法二时教法四重二谛当中，第二重二谛的胜义谛是性空，安立性空的名言——无自性，没有常一不变的独立存在性，对治的就是凡夫的我执，破我执，因为佛陀说，要想走向涅槃，走向解脱，必须从“有我”的凡夫走向“无我”的智者，所以打破心中的我执，一步步地淡化心中对我的执着，这就是大乘佛法的修行在纲领上的一个最一般意义上的定义，破我执，属于佛陀横向教理体系中破增益的部分。
胜义谛,胜义谛，佛教术语，梵文，paramārthasatya（梵文待查），谛，是道理的意思，世俗谛和胜议谛，是一对相对的名言，合称为二谛。二谛，就是两条道理：一个就叫做世俗谛，另一个被称为胜义谛。胜义谛就是在此世俗谛上，佛陀一定要引申出作为智者对这一重世俗谛境界的一个更殊胜的理解，这就是胜义谛。
世俗谛,世俗谛，佛教术语，梵文saṃvṛtisatya（梵文待查），谛，是道理的意思，世俗谛和胜议谛，是一对相对的名言，合称为二谛。二谛，就是两条道理：一个就叫做世俗谛，另一个被称为胜义谛。
三套缘起,三套缘起，佛教术语，梵文trividhaḥ pratītyasamutpādaḥ。缘起是佛法的核心教义。佛陀就是用缘起这样一个巨大的方便，来解构凡夫自以为的真实世界。在整个佛陀的教理体系当中，为了度化不同根性的众生，佛陀讲了三种缘起。佛陀教法的纵向教理体系，依照《解深密经》分为初时教法、二时教法和三时教法。在这三套相对独立的名言系统里，相应的佛陀就建立了三套缘起来破增益。佛陀在“初时教法”当中讲了“十二缘起”。在“二时教法”当中讲了“缘生缘起”。在“三时教法”当中讲了“藏识缘起”。依据《解深密经》三时判教，佛说的缘起只有这三套，没有第四种缘起，也就是这三种缘起，就能涵盖佛说的一切缘起。虽然都用了“缘起”，但是在这三时不同教法中，它的法义是不一样的，不能混淆。佛说缘起，并不是说由缘的和合而生起，其实是要表达由缘和合，并未真的生起事物。
悖论归谬模型（顿法）,悖论归谬模型，净名精舍术语，在认识论上对凡夫境界直接归谬而证空性。龙树菩萨在中论颂中所展现的修法，通过对凡夫境界直接归谬而证空性；佛教讲“无自性”，龙树讲的“空”，其实也是无自性，即就要破斥自性。龙树的破法，这个论证过程就叫归谬，就是把一个观点，归出错谬，来否定该观点，来破斥该观点。
二我,二我，佛教术语，指人我和法我。 在佛法体系里，对凡夫所执着的自以为的真实世界的划分有很多种方法，其中最简洁的一种方法就是把它分为两类，分别起名叫“人我”和“法我”。
