prompot,completion（内涵）
凡夫心,凡夫心，净名精舍术语。凡夫心的理解可以立足凡夫境界和圣者境界做不同的解读，二时教法是佛陀立足于凡夫境界向凡夫说法，二时教法说的凡夫心是凡夫自己当下的精神活动、觉知，即凡夫的心。大乘佛法佛陀对凡夫境界做了最彻底的解构，万法皆空、一切法无生，因此，在凡夫境界上说的“心”与“物”是不存在的、根本无生。二时教法的凡夫心是凡夫以为的凡夫境界，是空的对象。三时教法佛陀立足圣者境界向凡夫说法，三时教法说的凡夫心，也称为识、阿赖耶识、藏识，唯登地以上圣者能见，非凡夫臆度之所能知。三时教法的凡夫心指没有转识成智的识，由于是圣者能见的一分真实，只能转不能空，转识成智，就是从凡夫心转为圣者心。在三时教法看来圣者能见的凡夫心，也就是由虚妄分别熏习的杂染种子所积淀下的凡夫心。凡夫心、杂染种子、杂染依他起自性是障碍证悟圆成实自性的真正障碍。立足点不同是学习大乘佛法的要害，二时教法与三时教法由于说法的立足点的不同，导致了两套相对独立的名言系统，二时教法的“凡夫心”跟三时教法的“凡夫心”是不同的，因此，不可混讲，也不能混学。
圣者心,圣者心，净名精舍专业术语，指见道登地以上圣者的心。三时教法的“心”既代表凡夫心也代表圣者心，三时教法的“心”是唯见道登地以上的圣者能见，非凡夫臆度之所能知。凡夫心和圣者心只是心的两种不同状态，凡夫心是一种“分离”的认知模式，是糊涂的；基于对凡夫心认知模式的否定角度来表达，佛说圣者心是一种“不分离”的认知模式。指的是“能与所”的不分离，就是能认识的“心”与被认识的“物”的不分离，是无分别的，这种认知模式就是圣者心。三时教法中的“心”分 “识”与 “智”，“识”与 “智”都可以叫做 “心”，“识”也称阿赖耶识、藏识或凡夫心，“智”称为正智或圣者心。从三时教法的三自性中的依他起自性角度理解，依他起自性分杂染和清净两部分，杂染部分是“识”，清净部分是“智”，从“识”转变为“智”，叫做“转识成智”，就是从凡夫心转为圣者心。佛陀在三时教法中安立“识”，是为解构凡夫境界，重点在于破增益；“智”是为建构圣者境界，是补损减。
错觉,错觉，净名精舍术语，梵文vikalpa、prativikalpa或saṃkalpa等，即虚妄分别，指心外事物不存在而凡夫非误以为心外事物存在的错误认识。分别是虚妄的，为了便于理解，净名精舍首席学术导师于晓非教授引入现代词“错觉”，来表示虚妄分别。分别就是虚妄，分别就是错觉。
波罗蜜,波罗蜜，佛教术语，梵文pārami，音译为波罗蜜，同义梵文Pāramitā，音译为波罗蜜多 。基本含义是过河、到彼岸，意译为“渡”通“度”，佛教界习惯使用“度”。基于印度人对三世说生命观的独特理解，波罗蜜譬喻为过生命之河，过生死之河。就是从生生死死的轮回的此岸度到涅槃的彼岸。“波罗蜜”，是大乘佛教最能够传达佛教思想精髓的词汇之一，涉及佛陀教法要解决的根本问题。佛陀的初时、二时、三时教法就是给不同的众生提供过河的解决方案，佛说的一切法都是波罗蜜，小乘初时教法属于波罗蜜，大乘二时和三时教法属于甚深般若波罗蜜。
般若,般若，佛教术语，梵文prajñā，俗语形态paññā。“般若”是paññā的音译，是指凡夫内心普遍具有着的可以打破无明见真实的能力，勉强意译为“大智慧”，以区别于世智辩聪。般若的法义很深，凡夫具有两面性，一面是“无明所障”，另一面又具备着可以打破无明见真实的能力，这个能力就是般若。
外相,外相，净名精舍术语，梵文nimitta，lakṣaṇa，表示的都是外相，就是指由于分别而误以为心外有事物的相。无外相，梵文ānimitta，就是凡夫心外之相不存在。外相，属于佛陀三时教法名言体系，是学懂唯识的重要词汇之一。以眼翳执毛模型为例，阿赖耶识种子的现行两件事情，是显现与分别。显现，就是生了翳病的眼睛显现出了似毛的影，梵文叫ābhāsa，这个词往往翻译成影相，就是这个影的相，是似外之相。因此ābhāsa这个词，准确的翻译应该是“似相”，相似的似。对这个ābhāsa的“似相”起了分别，把一个似毛的影给误执为眼睛之外的真的毛。当误执为真毛存在的时候，这个毛也有相，比如说长短之相，直弯之相，那么对这个毛的相，梵文表达最常用的是两个词，一个是nimitta，一个是lakṣaṇa。这两个词，往往都翻译成“相”。其实严格意义上，它应该翻成“外相”，就是心外之物的相。凡夫位的修行，要对治的就是这个外相nimitta，要领受“境界自心现”，等到彻底领悟了无外相，就要见道登地做菩萨了。佛教说无相是有两重无相，无外相和无似相，就是无nimitta和无ābhāsa。
无似相,无似相，净名精舍术语，梵文 nirābhāsa ，就是ābhāsa加了一个否定的前缀nir，意思是没有ābhāsa的相，用个比喻就是生翳病的眼睛显现的似毛的影，这个影就是ābhāsa。加上否定前缀nir，nirābhāsa就是没有影，实叉难陀译为“无影”，也可以译为“无似相”。nirābhāsa这个词在《楞伽经》中，甚至在整个佛陀三时教理中，是举足轻重、至关重要的核心词之一，是佛陀三时教法讲的两重无相之一，如果分不清无外相和无似相，就不可能学懂唯识，就不可能通达佛陀三时教法，求那跋陀罗对nirābhāsa的错误翻译，是造成千百年来汉传佛教误读《楞伽经》的重要原因之一。在大乘佛法三时教法的眼翳执毛模型中，生了翳病的眼睛显现出了似毛的影，这个影在梵文里就叫ābhāsa，往往翻译成影相，就是这个影的相，是似外之相，因此ābhāsa准确的翻译应该是似相。无似相，就是把生翳病的眼睛治好了，似毛的影都没有了。也就是经过从初地到七地的修行，转染成净，对ābhāsa的显现坚决不做分别，以清净种子完全替代了杂染种子，以至于连ābhāsa的显现都没有了，证得无似相，彻底清除了证真如的障碍登八地证真如。因此，从七地登八地的标志就是证无似相。见道位之前的资粮位和加行位的修行，是了知心外境界，唯心所现；了知外相（nimitta）不存在，修“无外相相”。见道之后，初地到七地，虽无外相（nimitta），但往昔在阿赖耶识中种下的杂染种子还在，还会有ābhāsa的显现，因此，初地到七地修“无似相相”，所以无似相与无外相是完全不同的修行阶段。而佛教说无相是有两重无相，无外相和无似相，就是无nimitta和无ābhāsa。无外相而见道登初地，无似相而由七地登八地。
无外相,无外相，净名精舍术语，梵文a-nimitta，就是凡夫心外之相不存在。 大乘佛法修行空性、无相和无愿“三解脱门”，其中的无相，就是指无外相。
二边见,二边见，佛教术语，梵文antadvaya-grāha（待确认）。二是凡夫的基本特征，在佛陀看来，凡夫对凡夫自以为的真实世界的认知有一个特点，就是总是构建一对儿一对儿的相待的名言来理解、表达、描述凡夫自以为的真实世界。比如说凡夫面对着自以为真实的世界，总要作美与丑、善与恶、长与短、高与矮、生与灭、常与断等等的判断，这一对一对的名言总是相待而立的，所谓相待，是指这些名言只能在相互关联中而施设，不能独立地存在。凡夫总是用这种落于两边的认知模式来理解和表达这个世界，佛法把凡夫的这种认知模式叫做二边见。在佛陀看来，二是凡夫的基本特征，凡夫一定二，只要二就一定是凡夫。
心,心，佛学和哲学通用术语，对心的正确的、究竟意义解读，是指佛陀三时教法中讲的心，可以分为广义和狭义两个层面解读。狭义上讲，心，梵文是﻿citta，词根是ci，就是聚集、收藏的意思。就是表示所谓的心，具有聚集、收藏的作用。“心能积集业”，梵文是﻿cittena cīyate karma。这句偈颂的意思是用“心”，聚集、收藏业。广义上讲，心，指佛陀三时教法所讲述的阿赖耶识、正智、真如。
二时教法的心,"二时教法的心，最常见的表达是菩提心，佛教术语，梵文是bodhi-citta。般若经当中，把菩提心分成了两个方面，分别起名叫作“世俗谛菩提心”和“胜义谛菩提心”。从般若经看，世俗谛菩提心跟胜义谛菩提心两个菩提心都生起了，就算生起菩提心了。从大乘佛法的修行来讲，一切都是从发菩提心开始的。
在二时教法中，心的另一种含义，更多地表达为思想、精神、心灵、甚至是灵魂，英文常表达为mind、consciousness，甚至是soul。这是人们通常所理解的心，这种对于心的理解，是有主体的理解，认为心是我的心，是我的思想，是我的意识，甚至是我的灵魂。这是对心的错误的理解。对于这种理解，佛陀是批判的。对于这种理解的心，佛法讲是必须要空的。"
三时教法的心,"心，佛学和哲学通用术语，对心的正确的、究竟意义解读，是指佛陀三时教法中讲的心，可以分为广义和狭义两个层面解读。狭义上讲，心，梵文是﻿citta，词根是ci，就是聚集、收藏的意思。就表示所谓心，就是具有聚集、收藏的作用。“心能积集业”，梵文是﻿cittena cīyate karma。这句偈颂的意思是用“心”，聚集、收藏业。广义上讲，心，指佛陀三时教法所讲述的阿赖耶识、正智、真如。
"
胜义谛菩提心,胜义谛菩提心，佛教术语，梵文 āryasatya-bodhi-citta ，在世俗谛菩提心愿的驱使下，在空上度众生就是胜义谛菩提心。菩提心的法义很深，可以从不同角度，不同层次去解读菩提心，比如“性空”和“空性”的不同层次。二时教法对菩提心有个解读，这是入手修行大乘佛法的一个方便。般若经说菩提心是由两个方面组成的，分别起名叫作“世俗谛菩提心”和“胜义谛菩提心”。从般若经看，世俗谛菩提心跟胜义谛菩提心两个菩提心都生起了，就算生起菩提心了。胜义谛菩提心就是在世俗谛菩提心的心愿的驱使下，切切实实度化一切众生走向无余涅槃的当口，还要生起一个心，观一切法是空：能度众生的菩萨是空，被菩萨度的众生是空，菩萨度众生这件事儿还是空。
世俗谛菩提心,世俗谛菩提心，佛教术语，梵文saṃvṛtti-satyatva bodhi-citta，是要发心度一切众生走向涅槃。一个修行大乘佛法的人，在悲心驱使下，要对一切众生进行帮助，进行度脱，修行的结果是增加福德，这是世俗谛菩提心。菩提心的法义很深，可以从不同角度，不同层次去解读菩提心，比如“性空”和“空性”的不同层次。二时教法对菩提心有个解读，这是入手修行大乘佛法的一个方便。般若经说菩提心是由两个方面组成的，分别起名叫作“世俗谛菩提心”和“胜义谛菩提心”。从般若经看，世俗谛菩提心跟胜义谛菩提心两个菩提心都生起了就算生起菩提心了。世俗谛菩提心，就是在世俗谛上，一个修行大乘佛法的人，一定要生起一个心，按照《金刚经》的话讲，对于“所有一切众生之类，我皆令入无余涅槃而灭度之”。
熏习,熏习，佛教术语，梵文paribhāvita，众生的行为当生即灭了，但是这个行为会在藏识当中熏习下一颗种子，藏识里的种子就是由众生的行为熏习而来的。
不生不灭,"不生不灭，佛教术语，不生梵文是 anutpanna，佛陀说不生不灭，目的是说无生，两重无生。两重无生，皆是圣者证悟的境界。
大乘佛法里不生不灭的境界，分为两重无生。第一重无生是凡夫执著的境界无生，是凡夫境界“从来无，何须生”。第二重无生是佛陀亲证的真如无生，佛证真如“本来有，不需生”。学佛修行，从大乘佛法来讲，讲不生不灭，就是证这两重无生。
"
无我,"无我，佛教术语，梵文是anātman，可细分为人无我和法无我，即没有能认识世界的精神主体我，也没有被我所认识的客观世界。人无我、法无我，合称为“二无我”，简称“无我”。无我，是“无生”的另一种表达。
佛陀被称为“说缘起者”。“缘起”是佛教的重要标志。佛陀说缘起，就是为了说无生，就是为了说无我。"
六识,六识，佛教术语，梵文ṣaḍvijñāna（待查），六识是眼识、耳识、鼻识、舌识、身识、意识的统称。 在三时教法体系里边，我们讲只有一个识——阿赖耶识，前六识不过是阿赖耶识杂染种子现行时所表现出来的分别的功能，不是在阿赖耶识之外，还有这六个识，在三时教法里边，六识就是阿赖耶识，六识与阿赖耶识的关系是海浪与大海的关系，所以在三时教法里六识不能空，要转。二时教法里也有眼识、耳识、鼻识、舌识、身识、意识，但在二时教法里边，这六个识是凡夫当下的觉知的自己的凡夫心，是纯粹的属于凡夫境界，这就如同在二时教法里边讲色、声、香、味、触、法这六尘，这六种外境一样，是纯粹的凡夫境界，在二时教法中具体就是指眼耳鼻舌身意这六个器官上所具有的功能，这个识就是认识的识。在二时教法中这个六识是凡夫当下觉知的凡夫的心，是属于凡夫以为的凡夫境界，因此要空。
眼翳执毛模型,眼翳执毛模型，净名精舍术语，就是一个眼睛生了翳病的人，本来是因为生病，自身显现了影，他非不以为是影，非误以为是心外的毛，执着着这个心外的毛，这个执、这个错误认识的强化，就使得这个毛在我们的感知世界里无比真实了，坚不可摧了。可是佛陀告诉我们，其实这个毛根本不存在，存在的只是心外没有毛，你非误以为有毛的错觉而已。 此模型是理解三时教法核心藏识缘起的重要模型，由净名精舍首席学术导师于晓非老师总结构建。
种子熏现模型,种子熏现模型，净名精舍术语，是佛陀三时教法中描述藏识缘起的模型，也是理解胜义因果的重要模型，更是学习和理解佛陀三时教法理论体系的重要基础模型，由净名精舍首席学术导师于晓非老师总结构建。种子的熏习和现行，就是凡夫当下的行为（用梵文kṛ 来表述众生一切的行为），这个kṛ是无常的，是当生即灭的，但是它的作用要延续。在佛陀的三时教法，在唯识宗当中，这种作用的延续就是用藏识熏习种子的模型来表达的。这个kṛ无常、当生即灭，但是kṛ在藏识当中熏习下了一颗种子，而这颗种子等待因缘成熟的时候，它又会现行为一个新的kṛ，而这个新的行为、新的kṛ它依然是无常的、当生即灭的。这个新的kṛ虽然灭了，但是它的作用要延续下去，这个作用的延续就体现为这个新的kṛ，又在阿赖耶识、在藏识当中熏习下了一颗新的种子，这样的无穷的往复，就形成了众生的行为，以及导致这个行为所产生的那种延续的力量。在三时教法里，这就是藏识所安立的模型。这个模型我们给它起个名字，就叫做“种子熏现模型”。这里边的关键词，第一，是藏识—阿赖耶识；第二，就是kṛ；第三，就是熏习；第四，就是种子；第五，就是现行。现行这个词非常重要，翻译得非常好，它是现的行为，不是显现出物，而仅仅是显现的行为。在佛陀的三时教法，在瑜伽行派，在唯识宗里边，佛陀就是用种子熏现模型来描述我们凡夫心的活动。
眼识转起模型,眼识转起模型，净名精舍术语，是圣者对“看见了”是什么，是什么原因而产生了“看见了这件事儿”的理解。《大乘入楞伽经》中云：“有四种因缘眼识转。何等为四？所谓不觉自心现而执取故，无始时来取著于色虚妄习气故，识本性如是故，乐见种种诸色相故。”佛陀用四种因缘，讲述眼识转起模型。
阿赖耶识,阿赖耶识，佛教术语，梵文ālayavijñāna，也译作藏识，就是具有收藏的功能的识，又名空如来藏，亦即依他起自性的杂染部分，是圣者才能见的心识上的种子与kṛ（即虚妄分别）的相互缘起，是胜义因果，是“藏识缘起”，是登初地以上的菩萨、圣者才能见的凡夫心。
阿赖耶识四要点,阿赖耶识四要点，净名精舍术语，准确理解佛陀三时教法的关键之一，就是要准确理解阿赖耶识，为了很好把握阿赖耶识的法义，净名精舍首席学术导师于晓非老师依据《楞伽经》、《解深密经》等，总结了四条学习阿赖耶识的要点：第一，阿赖耶识是圣者能见的一分真实。第二，阿赖耶识是凡夫的错误认识所积淀。第三，既然阿赖耶识是圣者能见，所以阿赖耶识不能空。第四，阿赖耶识虽然不能空，但阿赖耶识毕竟是凡夫的错误认识所积淀的，因此空虽不能空，必须得转——转识成智。这是佛陀三时教法的特点，是三时教法的殊胜。
能取,能取，佛教术语，梵文grāha，凡夫误执心外有 nimitta，就一定会误以为还有一个真能执取心外之物的能力，这个能力，唯识学起个名字，叫“能取”，因此，“似能执取”心外之物的能力叫“见分”，凡夫误以为有的“真能执取”心外之物的能力叫“能取”。
所取,所取，佛教术语，梵文grāhya，“相分”是凡夫执心外有事物的诱因，而凡夫误执的心外事物，也就是外境或者叫外境之相，即外相nimitta，在唯识学里，起个名字，叫“所取”。ābhāsa 是相分，nimitta 是所取。
能所不分离,能所不分离，佛教术语，圣者的认知模式，从对凡夫的误以为能所分离的认知模式的否定角度来表达的话，圣者的认知模式就是“能所不分离”的认知模式，圣者心是能所不分离。
意,意，佛教术语，梵文 manas，音译为“末那识”，又叫“意根”，在阿赖耶识八分法中对应第七识。意是隐藏在分别背后，使分别得以实现的推动力。没有第七识的驱动，前六识是转不起来的。
意识,意识，佛教及哲学术语，梵文manovijñāna，指诸识中的第六识。在二时教法里讲的是六个识：眼识、耳识、鼻识、舌识、身识、意识，只讲这六个识。三时教法讲唯识，而且强调这个识只有一个阿赖耶识，也译作藏识。把阿赖耶识分为八份，就是八识。分别是眼识、耳识、鼻识、舌识、身识、意识、末那识、阿赖耶识。阿赖耶识杂染种子现行是显现与分别。分别就是把生翳病的眼睛显现的似毛的影，误以为心外的毛的这个误以为，这个错误认识。意识就是这个分别的功能。
如来藏,如来藏，佛教核心术语，梵文tathāgatagarbha，这是一个复合词，由两个词组成，第一个词，tathāgata，意思是如来；第二个词是garbha，古译通常被译成“胎藏”，用现代汉语直译，就是女人的子宫。tathāgatagarbha，合起来直译就是“能孕育如来的子宫”。如来藏意指佛是由如来藏孕育降生的意思，由此可见如来藏法义在整个佛陀教法体系中的重要性。
不空如来藏,不空如来藏，佛陀三时教法核心术语。佛陀证悟的真正的真实性就是真如，真如就是不空如来藏。
空如来藏,空如来藏，佛陀三时教法核心术语。阿赖耶识是圣者能见的一分真实，有时也被表达为来藏藏识、空如来藏。空如来藏，不是说如来藏本身是空，而是佛陀安立如来藏是为了“空”。为了空掉什么而安立的如来藏叫空如来藏。佛陀说“空”，其实就是要空掉凡夫误以为存在而圣者认为根本不存在的事物，是为了“破增益”。
三时四有四无无障碍观,三时四有四无无障碍观，净名精舍术语，佛陀三时教法破增益的修法的口诀：只有相互依存，没有独立存在；只有相似相续，没有常一不变；只有能了别识，没有所分别境；只有一隐一现，没有真实显现。“只有相互依存，没有独立存在”，是指立足于圣者境界安立藏识缘起，其中了别识与分别事识，也就是杂染种子与现行的 kṛ相互依存，互为因果，它们都不能独立存在。只有相似相续，没有常一不变”，指的是阿赖耶识未现行的杂染种子，总是处于相续的生灭过程之中，不能常一不变。“只有能了别识，没有所分别境”，是指立足于圣者境界观凡夫境界，只是唯识，没有凡夫心识之外的事物。“只有一隐一现，没有真实显现”，一隐就是虚妄分别在阿赖耶识中熏习下杂染种子；一现，就是阿赖耶识杂染种子现行，但是只是现行了虚妄分别，并没有显现出凡夫心外事物的真实存在。
转识成智,转识成智，佛教术语，又名“转染成净”，就是从识转变为智。就是从凡夫能所分离的认知模式，转变为圣者的能所不分离的认知模式；从凡夫的分别的识转为圣者的无分别的智。转识成智从梵文的角度讲，就是从 vijñāna转变成jñāna 。就是去掉vi，去掉vijñāna那个词头vi ，去掉vi就是离分别，转识成智是佛陀三时教法修行的核心。
kṛ,kṛ，净名精舍术语，kṛ是梵文中的一个动词词根，指众生的行为。，是对人甚至是对一切动物的行为的一个最一般的表达。比如说：我们看见一座山，这个“看”就是一个kṛ；我们听见了雷声，这个“听”也是一个kṛ；我们闻到一股香气，这个“闻”也是一个kṛ；我们尝到这个醋很酸，这个“尝”也是个kṛ；我摸到桌子了，这个“摸”也是一个kṛ；想念母亲了，这个“想”也是一个kṛ。也就是kṛ这个动词是对众生的行为的最一般的表达。
见分,见分，佛教术语，，即见似相之见。阿赖耶识杂染种子现行时的显现，除了显现似相，同时还要显现“见似相之见”。如同生了翳病的眼睛，除了显现了似毛的影，同时一定还显现“见影之见”。虽然“似毛之影”和“见影之见”都是在心识中，是不分离的，但毕竟可以分为两个方面来表达。在唯识学中，有的宗派就给这两个方面还安立了名言，似毛之影叫“相分”，见影之见叫“见分”。
相分,相分，佛教术语，梵文ābhāsa，即似相，阿赖耶识种子现行时显现的“似外之相”。
不常不断,不常不断，佛教术语，指远离常见和断见二边，而取“不常不断”的中道。 常见和断见，是凡夫最容易犯的一对边见。佛陀认为常见和断见都不是佛法的正见，所以，佛陀讲法，就要引领凡夫远离常见和断见，而契入中道。
初时不常不断,初时教法说的常见，是指认为众生生命主体之我为永远存续者，断见是指认为死后全归灭无。初时教法讲十二缘起、四谛无我，对治常见和断见。正确理解十二缘起之理，因而远离常见与断见的偏颇看法，即远离断常之二边见。
二时不常不断,二时教法的不常不断分为两个层次。第一个层次，权变中观境界，以二谛模式讲不常不断，既不常也不断。“既不常也不断”，不是安立了一个在“常”与“断”之外的一个第三种状态，所谓“不常不断”。实际上“既不常也不断”仍就属于二边见，是佛陀用来替代、对治“常、断”这对凡夫根深蒂固的原有的“二边见”的。第二个层次，究竟中观境界。泯灭二边立足于空性讲不常不断，因不常故不断。因为没有常，所以没有断；二边双泯，彻底远离了二边见。“因不常故不断”，这是佛陀的见解，是二时教法究竟中观中不常不断的见解，这就是在破增益。
三时不常不断,三时教法中，对二时教法的这种凡夫境界因不常故不断的“无生无常”，依然认同。同时对不常不断还有其独到的理解，在三时教法当中，增益就是常见，损减就是断见。既能领受凡夫境界根本无生，又能亲见圣者证悟的真如真实不虚，就是不增益凡夫境界、不损减圣者境界，这是三时教法的不常不断。三时教法的不常不断，既破增益，又补损减。
