prompot,completion（内涵）
二我执,二我执，佛教术语，即人我执、法我执。 人我执，梵文ātmagrāha，人我，佛教术语，梵文pudgala，凡夫认为自己内在的主观的精神世界，是一个真实存在，而且是不变的，独立的。法我执，法我，佛教术语，梵文dharmasvabhāva，当一个凡夫执着了内在主观精神的我的存在的时候，即人我存在的时候，就一定会攀缘着主观内在精神世界之外的一个世界。内在主观精神的世界，一定要依托着主观内在精神世界之外的一个外在客观的物质世界而存在。
修行次第,修行次第，佛教术语，就是修行的次序和步骤。佛陀教法的修行，特别是大乘佛法修行的次第，即怎么打破无明见真实。从大的次第来讲，是三个次第，叫作闻、思、修，就是听闻正法、如理思维、如法修行。从佛陀的横向教理体系的安排和修证的次第，可以分成先破增益后补损减两大次第。高度简洁地概括大乘佛法的修行过程可以用“境、行、果”三个字。作为凡夫的修行，首先就是对境发心，而后是如法修行，最终证无住涅槃而成佛。证无似相登八地，就能领受其实从凡夫到成佛，根本无次第，次第只是方便说。
缘起,缘起，佛教术语，梵文pratītyasamutpāda。用最简洁的语言概括表述缘起，就是缘起无生。缘起是佛法的标识。佛说缘起是为解构凡夫自以为的真实世界。佛陀教法的横向教理体系是破增益和补损减，缘起是佛陀破增益的手段、工具，这是佛说缘起的真实法义之所在。
真实,真实，佛教术语，梵文bhūta‐tathatāyā，指真相、真正的存在。依照“净名弘法六要点”第二点，佛陀教理体系在横向上可判为“破增益”和“补损减”两部分。对真实的诠表属于佛法中“补损减”的内容。即佛陀给那些通过佛陀教理第一部分的学习，已经认同了佛陀关于我们凡夫境界上、我们过去自以为真实的世界其实都是不真实的道理的人，讲了第二件事：什么才是佛陀证悟的真正的真实。对“真实”的如法理解首先要依照判教，其次要依照说法立足点的不同。佛陀在《解深密经》中对由于众生根性不同而讲的法作判教，分为初时教法、二时教法、三时教法，从不同角度和不同层次安立了不同的名言系统，告诉凡夫，其实凡夫自以为的凡夫境界上的真实世界，其实一点都不真实——破增益，并且佛陀告诉凡夫什么才是佛陀认为的真正的真实——补损减。
真实性,真实性，净名精舍术语，梵文tattva，指佛陀亲证的真正的真实性。三时教法表达为真如、圆成实自性、如来藏心、不空如来藏、法性等，指圣者心的行处；二时教法中多表达为“实相”，系无为法，属于横向教理体系中“补损减”的部分。
泯灭二边,泯灭二边，净名术语，泯灭，指的是灭绝、消失（自编）；二边，即二边见。
中观,中观，佛教术语，梵文madhyamaka，龙树菩萨对甚深般若波罗蜜的见解叫作中观见。中，指不着凡夫二边。中观，即远离凡夫二边的中道 。
本体论,本体论，哲学术语，英文Ontology，指探究世界的本原或基质的哲学理论，也叫做存在论。
顿法,顿法，净名精舍术语，指引导凡夫速疾证悟空性的修行法门。
渐法,渐法，净名精舍术语，是对凡夫境界平滑解构、次第消融而令众生证悟空性的法门，大乘佛法二时教法教理体系渐法的代表是净名精舍首席学术导师于晓非效仿古德构建的权变中观的“四重二谛”。
归谬,归谬，逻辑学术语，又叫反证法，是一种逻辑论证方法。
认识论,指不直接对对方的论点、论据及论证方式进行正面驳斥，而是按照对方的逻辑和思路推导出一个明显荒谬、虚假或矛盾的结论，使其论点不攻自破。一般分为：推论式反证法、矛盾式反证法等。大乘佛教龙树菩萨《中论颂》中使用归谬法对凡夫自以为的真实世界进行了无余否定的归谬解构。
中观的两重境界,中观的两重境界，佛教术语，指的就是权便中观和究竟中观。
不二,不二，佛教术语，梵文，advaya，指平等，相同，究竟意义上说就是无生法义中消融而不二、无分别。
佛,指佛陀对凡夫二边见认知模式的解构，引导凡夫从凡夫趋向圣者的法门，称为“不二法门”。凡夫自以为的真实世界以一对一对相待的名言去理解、描述，佛陀把凡夫这样的认知模式称为“二边见”，圣者看凡夫是二，只要二即是凡夫，大乘佛法二时教法抓住凡夫二的特点，以二为入手处，以解构二为方便善巧，彻底的解构凡夫自以为的真实世界，凡夫自以为的真实世界压根不真实、不存在。
佛三身,三身，佛教术语，梵文 trikāyāh，又作三身佛、三佛身、三佛，指佛的三种身，法身、报身、化身，其实并不是说佛有三种，而是这三种身是随修行者的不同根性、不同境界的显现。
无常,无常，佛教术语，梵文anitya，基本含义是指没有不变的，总是在变化着的。“常”，梵文是nitya，永恒不变的意思。佛法讲无常是有层次的，大乘佛法讲无常，是根本就无生，因此也无灭，这是无常。佛陀教法讲无常，分成三个层次。第一个层次是小乘佛法的生住异灭的无常，第二个层次是佛陀二时教法四重二谛的前两重二谛、作为大乘佛法前行法的无常，即当生即灭的无常。这两个层次的无常，可以归为一类，叫作“生灭无常”。第三个层次的无常，是第二组二谛所讲的无常，叫作“无生无常”，要观凡夫境界一切的法，压根儿没产生，这是无常，所以叫作“常无，故无常。”
两重无常,两重无常，净名术语，指生灭无常和无生无常。生灭无常，包括生住异灭的无常，和当生即灭的无常。在二时教法里，生灭无常只是无常的方便说，无常的究竟说是无生无常。以无生法义讲无常，无常的究竟法义就是无生，叫“常无故无常”，这才是甚深般若波罗蜜法门。
无生无常,无生无常，净名术语，无常的究竟说，是佛陀“二时教法”第三、四重“二谛”‐‐‐ 第二组“二谛”讲的“无常”，叫做“无生无常”，就是要观凡夫境界一切的法压根儿没产生，这是“无常”，所以叫做“常无故无常”。
生灭无常,生灭无常，净名术语，是无常的方便说，在佛法里讲“无常”是有层次的： 第一层次 – 小乘佛法讲无常：生住异灭的无常；第二层次 – 佛陀二时教法前两重二谛讲无常：当生即灭的无常。 以上两个层次说“无常”是生灭无常。
法,法，佛教术语，梵文是dharma，佛教高频词汇，广义上指事物、范畴、法则、正法，狭义上指佛说的法，佛陀言教。
法性,法性，佛教术语，梵文dharmatā，指佛陀证悟的诸法的真实性，即真如。
两重不二,不二，佛教术语，梵文，advaya，指远离二边的中道。两重不二，净名术语，指两重境界的不二。这是净名精舍首席学术导师于晓非老师在《金刚经》导读中，总结出的两重不二。这两重不二是于老师站在二时教法的角度总结的。两种不二具体概括为两种情形。就是法与法的不二和法与法性的不二。法与法的不二就是纯凡夫境界上的不二。如好与坏，生与灭，常与断，有与无。目的是解构凡夫境界自以为的真实世界。法与法性的不二，是指圣者境界与凡夫境界的不二。如生死与涅槃，烦恼与菩提，五蕴与空。目的是引领众生走向解脱、见真实、显示诸法真实性的无二。两重不二的安立，是为了对治，真正的不二，是彻底地泯灭“二”，并且是以完全地泯灭一边，而达到二边双泯，以此达到远离凡夫“二边见”的中道。
种性,"种性，佛教术语，梵文gotra，基本意思是牛的庇护所，引申的意思是家族、世系，指修行佛法的众生的“分类”。这里要区分开另一个梵文词varṇa，这个词的基本意思是肤色，皮肤的颜色，引申义就是依据肤色，依据不同人种划分的社会等级，这个词也经常被译为“种姓”，这是指印度婆罗门建立的印度的“种姓制度”里的不同种姓。
佛法的修行，对众生区分了不同种性，一共有五种。就是声闻乘修行种性、缘觉乘修行种性、如来乘修行种性、不定种性和无种性。这五种修行种性。是依据众生根性不同，就是依据众生对佛陀教法领受的能力不同而划分的。"
识的两种生住灭,识的两种生住灭，佛教术语，指阿赖耶识有两种生灭的表现，即相续的生灭和相的生灭。
现量,简单地讲就是凡夫依靠感觉器官，对于具体事物的直接感知，比如说看见了这张桌子，摸到了这把椅子，这就是现量
比量,就是指凡夫从给定的前提，推断出结论的行为，即推理或推测
圣言量,就是以教派的圣人教言作为标准，是量的一种
转依,转所依”就是转染成净，转识成智，就是从杂染所依的“识”转为清净所依的“智”，就是从能所分离的认知模式，转变成能所不分离的认知模式
遍计所执自性,就是遍计所执的存在，这是凡夫误以为的心外的存在，就是生了翳病的眼睛显现了似毛的影，而无明凡夫非执为心外的毛，这个毛就是遍计所执自性
五法,“五法”就是指五种法：相、名、妄想、正智、如如，五法与三自性、八识、二无我这四个道理是佛陀三时教法教理体系的四根支柱。
相,对相的理解需要依照梵文原词和判教，在三时教法中，相要作外相和似相两种理解，第一种，外相，梵文最常用的是两个词，nimitta和lakṣaṇa，nimitta一般用于表达抽象的相，lakṣaṇa往往表达具体的相，相貌、形状、特征的意思，这两个词往往都翻译成“相”，其实严格意义上，应该翻成“外相”，心外之物的相，是凡夫误以为存在着的心外事物的相，是遍计所执自性，凡夫认为存在，而圣者认为不存在第二种，似相，阿赖耶识杂染种子现行，要是两件事儿，显现与分别，显现，就是生了翳病的眼睛显现出了似毛的影，这个影梵文是ābhāsa，往往翻译成影相，指这个影的相，是似外之相
名,在三时教法中对“名”有两种不同的理解：第一，从凡夫角度看，名对应的梵文是nāma，就是名字、名言的意思，是遍计所执自性，是凡夫认为存在，而圣者认为不存在；第二，从圣者角度看，名不是名言本身，而是给妄想的心外事物“安立名言”，此时名属于依他起自性，是圣者能见的阿赖耶识杂染种子现行时表现出来的分别的功能，安立名言这件事，也是个kṛ（虚妄分别），就会在阿赖耶识熏习下杂染种子，就叫“名言种子”，正是“名言种子”作为主导力量，才形成了ābhāsa“似外的显现”
分别（妄想）,分别就是在圣者看来，凡夫心外根本没有事物存在，可非要误以为凡夫心外有事物存在的这个误以为 ，就是虚妄分别，作为五法之一时，更多的时候被译为“妄想”，是依他起自性的“杂染”部分
妄想,"就是虚妄分别，也译作分别，作为五法（名、相、妄想、正智和如如）之一时，更多的时候被译为“妄想”，是依他起自性的“杂染”部分，在佛法里，分别指的就是凡夫能所分离的认知模式，
就是在圣者看来，凡夫心外根本没有事物存在，可非要误以为凡夫心外有事物存在的这个误以为 "
正智,是指见道位之后登初地的菩萨一直到成佛的智，正智就是佛陀三时教法的纲领五法中的一法，对应于依他起自性的清净部分。圣者的认知模式，就是“能所不分离”的认知模式。
真如（如如）,如如，是圣者的心的行处。圆成实自性就是圣者证悟的真实性——真如；不空如来藏就是真如；法性就是真如
表诠,因明学用语，就是直接陈述、正面肯定的解释，表诠是一种表述方式，与遮诠相对。表诠本身也属于名言，是佛法的一部分，完整的佛法包括说通与宗通，表诠属于说通，只要有表诠，就有能诠与所诠
空,"空是佛教的标志，佛教也被称为“空门”，佛教说的空，空的是原本不存在，只是凡夫无明所障，误以为的存在。性空破我执，佛陀说无我，无自性；空性破实执，佛陀说无生，一切法压根没产生，
凡夫境界的存在是以什么都不存在、压根无生为基本特征的。"
清净（种子）,"佛教中清净是与杂染相对的概念，指无分别，也经常用来指佛陀三时教法中依他起性中的清净依他起。如实认知熏习的种子，就是清净种子。知道原来只是生了翳病的眼睛所显现出来的似毛的影，
仅仅是影，那个我们误以为的眼睛之外的毛其实根本、压根儿就不存在，这就是如实认知。"
杂染（种子）,"杂染在佛教当中具有特定含义，是与清净相对的概念，就是指分别。这个词也经常用来指佛陀三时教法中，依他起自性中的杂染部分。依他起自性的杂染部分，就是阿赖耶识的熏习与现行。
阿赖耶识中的那些积淀的种子，其实全都是凡夫误以为心外有物的错误认识所熏习的。是由这些错误认识熏习的种子而成就的阿赖耶识，这些虚妄分别成就的藏识。"
人无我,这个常一不变、独立存在的六道轮回中的精神主体，是不存在的，这就是“人无我”
法无我,三时教法了义的法无我就是知道五蕴、十八界、十二处都是遍计所执自性，就是觉知蕴、界、处等凡夫心外的一切事物，其实压根不存在。二时教法中的空性即法无我，也就是凡夫境界是以从来、压根就没有存在过为其基本特征
二无我智,"破除人我执和法我执之后圣者的智慧。二无我智有广义和狭义之说，从广义上讲，包含小乘人无我智和大乘二无我智。小乘人无我智随顺佛陀证悟的真实，随顺二无我智，但不究竟。
从狭义上讲，大乘了义教法，佛陀破除凡夫自以为的真实的世界，就是破“人我执”和“法我执”。"
净名弘法六要点,净名弘法六要点，净名精舍术语，指净名精舍弘法所依止的六个原则要点。一、严格依据《解深密经》纵向判教体系；二、坚持佛陀横向教理体系——破增益、补损减；三、二时教法与三时教法最根本的差异在于佛陀说法的立足点不同；四、学习弘传大乘佛法依止佛陀和六位论师；五、弘法力求简洁、通俗；六、净名精舍一切学习、讨论的佛法教理，都是观修的法门——理论与修行并重
净名度生四加一,"净名度生四加一，净名精舍术语，是净名精舍首席学术导师于晓非教授总结的度众生的布施修行法门。包括五件事：（一）努力告诉众生，佛说轮回如梦；（二）告诉众生佛陀找到的从人生大梦中醒来的方法；（三）如果一时半会醒不了，告诉众生佛陀教诲我们怎么做，就能导致美梦而不做恶梦；
（四）对那些正在做恶梦的众生，告诉他为什么别人在做美梦，而你却在做恶梦；（五）尽我们所能，努力帮助正在做恶梦的众生。"
说法的立足点,说法的立足点，净名精舍术语，是净名精舍首席学术导师于晓非教授总结的学修佛法的金钥匙。“立足点”本义指观察或判断事物时所处的立场。“说法的立足点”即基于三时判教的划分和佛经中所体现的教义、教理而归纳总结的佛陀说法的立场。因此，要理解《解深密经》三时判教的关键，是理解佛陀说法的立足点的差异。初时教法、二时教法和三时教法最根本的差别就在于佛陀说法的立足点不同：初时与二时教法，佛陀立足于凡夫境界向凡夫说法；而三时教法佛陀立足于圣者境界向凡夫说法。
中观见派,中观见派，佛教术语，梵文mādhyamika，是大乘佛教流派，是对佛陀的二时教法教理体系进行全面系统解读的学派，称为“空宗”，中国人简称中观。龙树被后世奉为中观见派的祖师，他被公认为是对佛陀二时教法的甚深般若波罗蜜法门的最权威阐释者。中观见派为印度大乘佛教的两大派别之一，另一为瑜伽行派，就是对三时教法教理体系全面系统解读的唯识，亦称为“有宗”
瑜伽行派,瑜伽行派，佛教术语，梵文yogācāra，对佛陀的三时教法进行梳理的学派称瑜伽行派，中国人称其唯识。唯识是个名言，指佛陀三时教法的学术体系。无著、世亲和弥勒是传承佛陀三时教法瑜伽行派，也就是唯识论的祖师。瑜伽行派典籍有《唯识二十论》、《唯识三十颂》、《三自性论》（Trisvabhāvanirdéca）、《摄大乘论》、《辩中边论》、「五蕴」、「集论」、「百法」、《瑜伽师地论》、《唯识》、《中边》、《现观》、《集论》、《瑜伽本地分》、《俱舍论》等。
印度大乘,印度大乘，印度哲学术语，公元前6世纪，佛教产生于印度，是世界三大宗教之一，创始人为乔答摩•悉达多(GautamaSiddhārtha)，被尊称为释迦牟尼(Śākyamuni)，意即“释迦族圣人”。他宣称觉悟真理，自称佛陀(buddha)，意即“觉悟者”，佛教由此得名。印度大乘，是印度佛教中的重要组成部分。大乘，梵文mahāyāna，亦称大乘教、大乘佛法，音译“摩诃衍那”、“摩诃衍”。mahā，大，yāna，车乘，故mahāyāna有大的车乘之意，是能够自利利他，自觉觉他，引领众生趣向解脱，圆满成佛的教法，大乘佛教以“普渡众生”成佛为目地。佛陀教法分三乘：人天乘、小乘和大乘；读每一部佛经的时候，首先都应判断，是属于佛陀教法体系的哪一个部分，判教是非常重要的，如果不了解判教，把这三套教法混起来学习，只能造成思想的混乱。佛陀印可的《解深密经》三时判教最权威。要特别强调的是，佛陀三乘佛法，不是每一个学佛者在这一生当中的修行次第。 大乘佛法的两个路径，也就是《解深密经》中指出的佛陀二时教法和三时教法，二者之间不存在次第关系。佛陀二时教法与三时教法，是两个独立的修行路径。一个能够发起菩提心的人，直截了当修大乘法。
登地菩萨,登地菩萨，佛教术语，登地梵文bhūmy-ākramaṇa，菩萨梵文bodhisattva，在佛教中指见到佛陀证悟的真实的菩萨。大乘佛法不同的经典，对菩萨道的修行，在阶段的划分上有不同的划分方法。最常见的划分方法，把从凡夫到成佛整个菩萨道的修行历程，分成五个阶段，也叫五位。分别起名叫资粮位、加行位、见道位、修道位、证道位，描述了一个凡夫从发心到最后成佛的完整的修行历程。见道，佛教也叫“现证真实”，就是见到了佛陀证悟的真实。之后进入修道位。见道之后，也叫登地的菩萨，就进入了初地、二地、三地、四地、五地、以至十地，然后等觉、妙觉，这样一系列的不断深入的阶段的修行。见道之后的这些登地菩萨的修行，是基于诸法的真实性而发心、而修行六度境界是不一样的。佛陀证悟的真实，在二时教法常用的名言是“实相”，在三时教法叫真实性，叫“真如”。佛教界公认最著名的登地菩萨是龙树菩萨。
菩萨乘,菩萨乘，佛教术语，梵文bodhisattva-yāṇa，由bodhisattva和yāṇa两个词组成，指大乘佛法，“菩萨乘，也就是大乘，”。菩萨，梵文是bodhisattva，音译成“菩提萨埵”，由两个词组成的，bodhi和sattva。bodhi是觉，sattva指有情，就是众生。bodhisattva合起来译作“觉有情”，就是“自觉觉他的有情”。觉有情有两重含义：第一，所谓觉有情就是不断努力寻求自我觉悟的有情，即感到生死轮回的苦，感到自己无明所障，要打破无明，要解脱，努力寻求自我觉悟的有情；第二，佛陀说这世界是缘生的，这世界是无我的，最后发现哪里有一个孤零零的自我的觉，我的觉就是众生的觉，离开了众生的觉，没有一个我的觉，实现我的觉就是要实现众生的觉，离开了实现众生的觉没有一个孤零零的我的觉。因此这些不断努力寻求自我觉悟的众生，发现自我觉悟只有通过觉悟其他众生而实现，所以觉有情的第二重含义就是觉他。yāṇa音译为衍那，意译为运输工具，引申义为乘渡。
三乘,三乘，佛教术语，梵文trīṇiyānāni，佛陀显教的教理，分为三乘，即人天乘、小乘和大乘。认同了三世说生命观，但生不起出离心的人，佛陀为他们讲了人天乘的法。认同了三世说生命观又能生起出离心，但生不起菩提心的人，佛陀给他们说了小乘佛法的法。声闻乘和缘觉乘，这两个乘合起来，就是通俗讲的小乘。佛陀给认同了三世说生命观又能够生起出离心，还能够生起菩提心的人，说了大乘佛法。 对小乘教法和大乘教法，依《解深密经》，又做了三时判教，小乘佛法又被称为初时教法，而大乘佛法分为二时教法和三时教法。初时教法对应的就是声闻乘和缘觉乘，而二时教法跟三时教法是菩萨乘，也就是大乘。
无住涅槃,无住涅槃，佛教术语，梵文apratiṣṭhita-nirvāṇa，指佛的涅槃，即大乘佛法修行的佛果，是智不住生死，悲不住涅槃，佛陀以宏深悲愿不入涅槃而永度众生，这是大乘佛法的不共，这是大乘佛法的殊胜。在《楞伽经》中就表达为佛不住涅槃，涅槃不住佛，亦称为无住处涅槃。
增益,佛教术语，梵文samāropa，就是凡夫死死抓住了一个在佛陀看来根本不真实的世界把它当成真实，这种真实性是凡夫强加上去的，是错误认识造成的，这个错误在佛教里边叫作增益。增益就是我们这些凡夫无明所障，糊涂，误把我们凡夫境界上的在佛陀看来根本不真实的世界当作真实。我们把凡夫境界上我们误以为真实的世界死死地抓在手里，而佛陀说，这就是妨碍着我们见到真实的最大障碍。增益与损减是连带性错误，只要增益就一定损减。凡夫无明，把没有的当作有，这个增益的有，其实是不存在的，不可得的。不能如实观察增益有的不可得，执著增益有为真有，这就是见证真实性的障碍，因此就一定损减。佛陀说，这就是增益相和损减相。
损减,损减，佛教术语，梵文是apavāda，就是见不到真正的真实的错误，就是不承认圣者、佛陀有亲证的真实性，也就是把真实性在我们凡夫心中给丢掉了，那么这个错误，佛教里给了一个专有名词，叫损减。增益与损减是凡夫犯的两个根本性错误。增益的错误，就是我们凡夫死死抓住了一个在佛陀看来根本不真实的世界把它当成真实，这种真实性是凡夫强加上去的，是错误认识造成的，这个错误在佛教里边叫做“增益”（samāropa）。正是因为有了增益的错误，我们死死地抓住了一个在佛陀看来根本不真实的世界当真实，因此佛陀认为，我们就再也见不到真正的真实了。见不到真正的真实的错误，佛教里给了一个专有名词，叫“损减”。因为增益，因为我们把不真实的当成了真实，所以我们见不到佛陀证悟的真正真实，这就是损减。
中道,中道，印度哲学术语，梵文madhyamā-pratipat，原意是指不堕入二元对立、远离二边见的见解，也就是“不二”就是中道。在佛教中，对中道的究竟意义的解读是指远离增益与损减的“不增益、不损减”的境界。中道在佛教当中是非常重要的概念，对中道的解读要依据判教解读。
不落世俗因果不昧胜义因果,"“不落因果，不昧因果”，此典故来自盛唐时期一禅宗公案，百丈禅师在江西的百丈山开堂说法，点化一野狐而得。在佛教中，讲因果有两重境界, 世俗因果是凡夫境界上法与法之间的因果，是假因果，必须空。世俗因果不空，凡夫境界解构不彻底，就无法见道解脱。胜义因果是立足于圣者境界安立的藏识缘起，是真因果,不能空。胜义因果不是给凡夫境界找到因，而是给凡夫境界不存在，凡夫 误以为存在的“错觉”(虚妄分别)找到因。世俗因果是“所”上的因果，落宿命，无法解脱。胜义因果是 “能”上的因果，有因果但不落宿命。不落世俗因果，不昧胜义因果。 能(因)上精进，所(果)上随缘。"
